tzinfo-data,1.2019.3,MIT,Approved,http://opensource.org/licenses/mit-license,Timezone Data for TZInfo,http://tzinfo.github.io
uber,0.0.15,MIT,Approved,http://opensource.org/licenses/mit-license,"Gem-authoring tools like class method inheritance in modules, dynamic options and more.",https://github.com/apotonick/uber
unf,0.1.4,2-clause BSDL,Approved,"",A wrapper library to bring Unicode Normalization Form support to Ruby/JRuby,https://github.com/knu/ruby-unf
unf_ext,0.0.7.7,MIT,Approved,http://opensource.org/licenses/mit-license,Unicode Normalization Form support library for CRuby,https://github.com/knu/ruby-unf_ext
unicorn,5.5.3,"GPL-2.0+,Ruby-1.8",Approved,",",Rack HTTP server for fast clients and Unix,https://yhbt.net/unicorn/
uri_template,0.7.0,MIT,Approved,http://opensource.org/licenses/mit-license,A templating system for URIs.,http://github.com/hannesg/uri_template
vault,0.10.1,Mozilla Public License 2.0,Approved,https://www.mozilla.org/media/MPL/2.0/index.815ca599c9df.txt,Vault is a Ruby API client for interacting with a Vault server.,https://github.com/hashicorp/vault-ruby
virtus,1.0.5,MIT,Approved,http://opensource.org/licenses/mit-license,Attributes on Steroids for Plain Old Ruby Objects,https://github.com/solnic/virtus
